Source,Date,Headline,Link
Fox News,20110301,"GAO Report Reveals Massive Waste
Contributing to America's $14T Debt",https://web.archive.org/web/20110301172608/http://www.foxnews.com/
Fox News,20110302,Libya Inches Closer to Civil War,https://web.archive.org/web/20110302035206/http://www.foxnews.com/
Fox News,20110303,Rebels Surround Key Libyan Oil Hub,https://web.archive.org/web/20110303125129/http://www.foxnews.com/
Fox News,20110304,Wisconsin Workers Brace for Layoffs,https://web.archive.org/web/20110304161403/http://www.foxnews.com/
Fox News,20110305,Libyan Refugee Effort Under Strain,https://web.archive.org/web/20110305091834/http://www.foxnews.com/
Fox News,20110306,,
Fox News,20110307,"
Libyan Rebels Attacked From Above",https://web.archive.org/web/20110307064128/http://www.foxnews.com/
CNN,20110301,Charlie Sheen: 'I'm on a quest',http://web.archive.org/web/20110301060351/http://www.cnn.com/
CNN,20110302,Supreme Court rules for anti-gay church,http://web.archive.org/web/20110302174906/http://www.cnn.com/
CNN,20110303,DNA inconclusive in Earhart search,http://web.archive.org/web/20110303122924/http://www.cnn.com/
CNN,20110304,"Unions: Blood, sweat & bargaining",http://web.archive.org/web/20110304152704/http://www.cnn.com/
CNN,20110305,A doctor faces his worst fear,http://web.archive.org/web/20110305183603/http://www.cnn.com/
CNN,20110306,Mom arrested in death of girl found in pest control truck,http://web.archive.org/web/20110306015733/http://www.cnn.com/
CNN,20110307,Opposition repels onslaught; government declares victories,http://web.archive.org/web/20110307060720/http://www.cnn.com/
NY Times,20110301,"In U.S.-Libya Nuclear Deal, a Qaddafi Threat Faded Away",https://web.archive.org/web/20110301132235/http://www.nytimes.com/
NY Times,20110302,Arab Unrest Puts Their Lobbyists in Uneasy Spot,https://web.archive.org/web/20110302110019/http://www.nytimes.com/
NY Times,20110303,Justices Rule for Protesters at Military Funerals,https://web.archive.org/web/20110302181726/http://www.nytimes.com/
NY Times,20110304,Obama Tells Qaddafi to Quit and Authorizes Refugee Airlifts,https://web.archive.org/web/20110304013646/http://www.nytimes.com:80/
NY Times,20110305,Qaddafi Militia Storms Key Town Held by Libyan Rebels,https://web.archive.org/web/20110305134546/http://www.nytimes.com/
NY Times,20110306,Business Side of Egypt’s Army Blurs Lines of Aid From U.S.,https://web.archive.org/web/20110306134428/http://www.nytimes.com/
NY Times,20110307,"A Libyan Leader at War With Rebels, and Reality",https://web.archive.org/web/20110307120522/http://www.nytimes.com/
WSJ,20110301,No-Fly Zone Eyed in Libya,https://web.archive.org/web/20110301073709/http://online.wsj.com/home-page
WSJ,20110302,States Make Play for Web Gambling,https://web.archive.org/web/20110302092305/http://online.wsj.com/home-page
WSJ,20110303,West Cools on Libya No-Fly Zone,https://web.archive.org/web/20110303044103/http://online.wsj.com/home-page
WSJ,20110304,Boehner Aims to Tame Benefits Programs,https://web.archive.org/web/20110304123047/http://online.wsj.com/home-page
WSJ,20110305,,
WSJ,20110306,Gadhafi Forces Push Back Against Rebels,https://web.archive.org/web/20110306155021/http://online.wsj.com/home-page
WSJ,20110307,Obama Backs Guantanamo Military Trials,https://web.archive.org/web/20110307213925/http://online.wsj.com/home-page
Washington Post,20110301,Rebels hold off Gaddafi loyalists in six-hour battle,https://web.archive.org/web/20110301124323/http://www.washingtonpost.com/
Washington Post,20110302,"Locked in standoff, Gaddafi foes debate foreign airstrikes",https://web.archive.org/web/20110302015556/http://www.washingtonpost.com/
Washington Post,20110303,Supreme Court upholds right of funeral protesters,https://web.archive.org/web/20110303011904/https://www.washingtonpost.com/
Washington Post,20110304,U.S. prepares for possible rise of new Islamist regimes,https://web.archive.org/web/20110304115508/https://www.washingtonpost.com/
Washington Post,20110305,Libyan rebels suffer brutal setbacks,https://web.archive.org/web/20110305140959/http://www.washingtonpost.com/
Washington Post,20110306,Siege in Libyan city hints at civil war,https://web.archive.org/web/20110306130530/http://www.washingtonpost.com/
Washington Post,20110307,Loyalists' deadly ambush repels Libyan opposition,https://web.archive.org/web/20110307143521/http://www.washingtonpost.com/
